{
  "name": "Pathiri",
  "slug": "pathiri",
  "region": [
    "kerala"
  ],
  "category": "food",
  "description": "Pathiri is a traditional thin, soft, white flatbread made from finely ground rice flour, popular in the Malabar region of Kerala and typically served with rich meat or vegetable curries.",
  "localNames": {
    "malayalam": "പത്തിരി"
  },
  "tags": [
    "food",
    "cuisine",
    "breakfast",
    "kerala",
    "pathiri"
  ],
  "creator": {
    "name": "Ananthapadmanabhan M",
    "github": "blitzbugg"
  },
  "source": {
    "type": "original"
  },
  "license": "CC-BY-4.0",
  "sources": [
    {
      "title": "Pathiri - Wikipedia",
      "url": "https://en.wikipedia.org/wiki/Pathiri"
    },
    {
      "title": "Kerala Cuisine - Wikipedia",
      "url": "https://en.wikipedia.org/wiki/Kerala_cuisine"
    }
  ],
  "notes": "Generated by the community lead blitzbugg"
}