{
  "name": "Kerala Pappadam",
  "slug": "kerala-pappadam",
  "region": [
    "kerala"
  ],
  "category": "food",
  "description": "Pappadam is a very thin, crisp, round fried wafer made from black gram flour, known for its light, brittle texture and subtle bubbles, and served as an essential crunchy accompaniment in Kerala Sadya and everyday Kerala meals",
  "localNames": {
    "malayalam": "പപ്പടം"
  },
  "tags": [
    "food",
    "cuisine",
    "sadya",
    "kerala"
  ],
  "creator": {
    "name": "Ananthapadmanabhan M",
    "github": "blitzbugg"
  },
  "source": {
    "type": "original"
  },
  "license": "CC-BY-4.0",
  "sources": [
    {
      "title": "Papadum - Wikipedia",
      "url": "https://en.wikipedia.org/wiki/Papadum"
    },
    {
      "title": "Kerala Sadya",
      "url": "https://en.wikipedia.org/wiki/Sadya"
    }
  ],
  "notes": "Generated by the community lead blitzbugg"
}