{
  "name": "Kathakali",
  "slug": "kathakali",
  "region": [
    "kerala"
  ],
  "category": "tradition",
  "description": "Kathakali is a traditional classical dance-drama from the southern Indian state of Kerala, renowned for its vibrant costumes, elaborate mask-like makeup, and powerful storytelling through facial expressions and gestures",
  "localNames": {
    "malayalam": "കഥകളി"
  },
  "tags": [
    "art",
    "tradition"
  ],
  "creator": {
    "name": "Ananthapadmanabhan M",
    "github": "blitzbugg"
  },
  "source": {
    "type": "original"
  },
  "license": "CC-BY-4.0",
  "sources": [
    {
      "title": "Kalamandalam",
      "url": "https://kalamandalam.ac.in/kathakali/"
    }
  ],
  "notes": "Generated by the community lead blitzbugg"
}